id,title,score,num_comments,author_fullname,subreddit_subscribers,created,url
1bk6dl2,"Milde interessant: Das System von DPD kennt scheinbar kein ""ü"" und macht bei Adressen einen Smiley daraus ",2135,124,t2_6xhqj,1874033,2024-03-21 13:21:02,https://i.redd.it/lsltwdniuopc1.jpeg
1bk2wjg,Friedrich Merz findet Kiffen »furchtbar« – aus eigener Erfahrung,703,403,t2_d7az3,1874033,2024-03-21 09:56:41,https://www.spiegel.de/politik/deutschland/cannabis-legalisierung-friedrich-merz-fand-erfahrung-waehrend-der-schulzeit-furchtbar-a-1b80861f-c636-42f2-b367-65be36806f8a
1bk9iuv,"Michael Wendlers Konzert in der Schweiz wurde abgesagt. Michael Wendler hat sein Comeback in der Schweiz geplant. Doch plötzlich werden alle Tickets storniert, der Veranstalter taucht unter – und das Konzert ist abgesagt.",660,116,t2_r7ub6,1874033,2024-03-21 15:40:49,https://www.bunte.de/stars/michael-wendlers-konzert-in-der-schweiz-wurde-abgesagt.html
1bk12sk,Rund 75 Millionen Deutschlandtickets bislang verkauft,616,250,t2_lv5bvujo,1874033,2024-03-21 07:42:37,https://www.golem.de/news/oepnv-rund-75-millionen-deutschlandtickets-bislang-verkauft-2403-183339.html
1bk689y,Nur noch halb so viele finden sie gut: Grüne sind heute deutlich unbeliebter als vor fünf Jahren,484,339,t2_w2y7e99,1874033,2024-03-21 13:13:38,https://www.tagesspiegel.de/politik/nur-noch-halb-so-viele-finden-sie-gut-grune-sind-heute-deutlich-unbeliebter-als-vor-funf-jahren-11399843.html
1bk2047,Nach der Bundestagswahl: Wagenknecht-Partei soll neuen Namen bekommen,346,182,t2_pk0zvne9,1874033,2024-03-21 08:51:48,https://www.t-online.de/nachrichten/deutschland/parteien/id_100368004/sahra-wagenknecht-bsw-soll-nach-bundestagswahl-neuen-namen-bekommen.html
1bka1mb,Weg frei für Cannabis-Gesetz?: Schwindender Widerstand im Bundesrat,344,86,t2_vfz510lb,1874033,2024-03-21 16:03:02,https://www.tagesspiegel.de/politik/weg-frei-fur-cannabis-gesetz-schwindender-widerstand-im-bundesrat-11403035.html
1bk5khf,Komisch ausgefragt an Haltestelle,338,116,t2_4omxohnv,1874033,2024-03-21 12:39:32,https://www.reddit.com/r/de/comments/1bk5khf/komisch_ausgefragt_an_haltestelle/
1bk3kff,Endlich Werbung auf meinem sonst so trostlosen Pizzakarton,338,44,t2_l6zexo9,1874033,2024-03-21 10:41:14,https://i.redd.it/qyq8l3mu1opc1.jpeg
1bk2snt,Bundestag: Impressumspflicht soll auf den Prüfstand,295,109,t2_st62x30p,1874033,2024-03-21 09:48:45,https://netzpolitik.org/2024/bundestag-impressumspflicht-soll-auf-den-pruefstand/
1bk5iap,Krieg in Nahost: Fregatte »Hessen« zerstört Drohne der Huthi-Milizen,277,102,t2_4ev3vgvv,1874033,2024-03-21 12:36:01,https://www.spiegel.de/politik/deutschland/krieg-in-nahost-fregatte-hessen-zerstoert-drohne-der-huthi-milizen-a-f394d3b1-b663-4add-a86a-d7f1ce5e49a7
1bk9y89,"Nachdem er gestand, schon mal gekifft zu haben: Hausdurchsuchung bei Friedrich Merz",272,5,t2_x4yzb,1874033,2024-03-21 15:59:23,https://www.der-postillon.com/2024/03/merz-hausdurchsuchung.html
1bk9k5y,Nike wird neuer DFB-Ausrüster ab 2027,253,158,t2_zfd7a,1874033,2024-03-21 15:42:21,https://www.dfb.de/news/detail/nike-wird-neuer-dfb-ausruester-ab-2027-259898/
1bkaofp,„Ich habe keinen Bock mehr“: Berlins ältester Teppichhändler schließt seinen Laden,250,68,t2_vfz510lb,1874033,2024-03-21 16:29:24,https://www.tagesspiegel.de/berlin/ich-habe-keinen-bock-mehr-berlins-altester-teppichhandler-schliesst-seinen-laden-11382688.html
1bk1xe2,„Staatliche Stellen“ planten Anschlag auf Bochumer Synagoge: Auswärtiges Amt bestellt Irans Botschafter ein,234,21,t2_pnkhvps2,1874033,2024-03-21 08:46:20,https://www.tagesspiegel.de/politik/geplanter-anschlag-in-bochum-auswartiges-amt-bestellt-irans-botschafter-ein-11399063.html
1bk4w55,Solingen: Mann flüchtet nach Auffahrunfall mit fremdem Auto und fremden Kindern,199,51,t2_5uod4cet,1874033,2024-03-21 12:01:46,https://www.spiegel.de/panorama/justiz/solingen-mann-fluechtet-nach-auffahrunfall-mit-fremdem-auto-und-fremden-kindern-a-b1abc06a-16aa-4e09-b4b7-39d707f62a5a
1bkgkk5,»Heute schreiben wir Geschichte«: Heike Heubach wird die erste gehörlose Abgeordnete im Bundestag,197,37,t2_64g6bxmp,1874033,2024-03-21 20:29:49,https://www.spiegel.de/politik/bundestag-heike-heubach-wird-die-erste-gehoerlose-abgeordnete-a-72a1ec3d-3612-4b41-b129-d53d253af1b0?sara_ref=re-so-app-sh
1bk1wj8,Wahlumfrage in Thüringen: AfD verliert an Rückhalt - BSW bei 15 Prozent,150,75,t2_js5a5,1874033,2024-03-21 08:44:35,https://www.mdr.de/nachrichten/thueringen/wahlumfrage-landtagswahl-bsw-afd-hoecke-ramelow-100.html
1bk8mo5,Medienbericht - China und Russland schließen Abkommen mit Huthi-Rebellen zum Schutz ihrer Schiffe im Roten Meer,156,24,t2_p571j,1874033,2024-03-21 15:03:02,https://www.deutschlandfunk.de/china-und-russland-schliessen-abkommen-mit-huthi-rebellen-zum-schutz-ihrer-schiffe-im-roten-meer-100.html
1bk32rg,Ukrainische Drohne kann Panzer autonom angreifen und zerstören,126,51,t2_j4tom,1874033,2024-03-21 10:08:39,https://www.derstandard.at/story/3000000212492/ukrainische-drohne-kann-panzer-autonom-angreifen-und-zerstoeren
1bk20w0,"""Niveaulos und bösartig"": SPD-Politikerin knöpft sich Strack-Zimmermann vor",107,92,t2_pk0zvne9,1874033,2024-03-21 08:53:16,https://www.t-online.de/nachrichten/deutschland/innenpolitik/id_100368784/ukraine-politik-strack-zimmermann-und-spd-im-streit-niveaulos-.html
1bk7af6,EU-Renaturierungsgesetz steht nun doch kurz vor dem Aus | Nach Ungarns überraschendem Kurswechsel braucht Europas Gesetz zur Rettung seiner Natur nun selbst Wiederbelebungsmaßnahmen. In Brüssel verfehlte es heute bei einer Testabstimmung die nötige Mehrheit denkbar knapp.,105,15,t2_lljpe,1874033,2024-03-21 14:04:00,https://www.spektrum.de/news/eu-renaturierungsgesetz-steht-nun-doch-kurz-vor-dem-aus/2211617
1bkdovg,"Prorussische Imagekampagne kursierte in blauem Verkehrsministerium: Norbert Hofers Generalsekretär beschäftigte sich mit einem Konzept, wie man Russlands Beliebtheit steigern könne.",98,14,t2_j4tom,1874033,2024-03-21 18:31:27,https://www.derstandard.at/story/3000000212548/prorussische-imagekampagne-kursierte-in-blauem-verkehrsministerium
1bk7t1k,Ausgeschlumpft in Ribnitz-Damgarten: Mutter kennt wahren Grund für Polizeibesuch,103,80,t2_8ci14vsl,1874033,2024-03-21 14:27:27,https://www.t-online.de/nachrichten/panorama/buntes-kurioses/id_100368328/schlumpf-in-ribnitz-damgarten-mutter-kennt-wahren-grund-fuer-polizeibesuch.html
1bk2vbv,StVO-Novelle: Erleichterungen für Gemeinden und Städte bei Tempo 30,69,17,t2_v0v445po,1874033,2024-03-21 09:54:09,https://www.vienna.at/stvo-novelle-erleichterungen-fur-gemeinden-und-stadte-bei-tempo-30/8634718
1bk7y97,München muss nach Urteil des VGH strengere Dieselfahrverbote umsetzen,70,10,t2_h41ov,1874033,2024-03-21 14:33:53,"https://www.br.de/nachrichten/bayern/vgh-urteil-muenchen-muss-strengere-diesel-fahrverbote-umsetzen-erfolg-fuer-duh-und-vcd,U7YMSz9"
1bk3iw9,"EuGH: Fingerabdruckpflicht im Ausweis ist rechtens, Verordnung aber ungültig​",67,20,t2_i5y6x,1874033,2024-03-21 10:38:23,https://www.heise.de/news/EuGH-Fingerabdruckpflicht-im-Ausweis-ist-rechtens-Verordnung-aber-ungueltig-9661552.html
1bk8j67,USA verklagen Apple – was dem Tech-Giganten vorgeworfen wird,66,10,t2_cj66y,1874033,2024-03-21 14:59:18,https://www.t-online.de/digital/aktuelles/id_100369450/usa-klage-gegen-apple-vorwurf-des-monopol-missbrauchs.html
1bka81l,Wurden Grundstücksbesitzer getäuscht? Klage gegen Gemeinde wegen neuem Windpark,64,12,t2_8k2tyv0c,1874033,2024-03-21 16:10:23,https://www.swr.de/swraktuell/baden-wuerttemberg/tuebingen/streit-um-grundstueck-nahe-geplantem-windpark-in-starzach-100.html
1bk1pt8,Gehirnimplantat: Patient mit Neuralink-Chip spielt Schach mit seinen Gedanken,56,49,t2_ny58azc,1874033,2024-03-21 08:30:17,https://www.zeit.de/wissen/2024-03/neuralink-implantat-patient-spielt-schach-gedanken
1bkhpyu,Wir wurden verklagt. | Simplicissimus,57,12,t2_bamjgcg8,1874033,2024-03-21 21:16:30,https://youtu.be/GVfR3k0wc-o?si=4v7dPaUYCHAfRy-Q
1bka658,Polizeinotruf 110: Anrufende in Notfallsituationen sollen automatisch geortet werden,51,18,t2_og8rm,1874033,2024-03-21 16:08:16,https://netzpolitik.org/2024/polizeinotruf-110-anrufende-in-notfallsituationen-sollen-automatisch-geortet-werden/
1bkrisz,Habeck warnt vor einem Landkrieg: Ampelkoalition diskutiert erneut höhere Rüstungsausgaben | Wirtschaftsminister Robert Habeck fordert eine schnellere Aufrüstung. Das Echo in der Ampel ist geteilt. Der finanzielle Spielraum ist gering,99,29,t2_da7vmytv,1874033,2024-03-22 05:06:54,https://www.tagesspiegel.de/politik/habeck-warnt-vor-einem-landkrieg-ampelkoalition-diskutiert-erneut-hohere-rustungsausgaben-11405180.html
1bk40u4,Neues Bundesdatenschutzgesetz - noch mehr Macht für die Schufa?,40,20,t2_js5a5,1874033,2024-03-21 11:10:04,https://www.tagesschau.de/investigativ/ndr/auskunfteien-gesetzentwurf-schufa-100.html
1bkbw4g,"Gereon Bollmann: AfD scheitert erneut mit Kandidatur für Bundestagspräsidium. Neuer Anlauf, neue Niederlage: Die AfD versucht seit 2017, einen Fraktionsvertreter ins Präsidium des Bundestages zu bringen. Das Votum gegen den Abgeordneten Gereon Bollmann fiel nun deutlich aus.",34,5,t2_r7ub6,1874033,2024-03-21 17:18:45,https://www.spiegel.de/politik/deutschland/gereon-bollmann-afd-scheitert-erneut-mit-kandidatur-fuer-bundestagspraesidium-a-beeba0be-847f-4357-9c0c-6a083f98f366
1bk0kf3,"KW 12 / 24 (Donnerstag): Was geschieht bei euch in der Region, wovon wir nichts mitbekommen?",37,56,t2_6zrxs,1874033,2024-03-21 07:05:22,https://www.reddit.com/r/de/comments/1bk0kf3/kw_12_24_donnerstag_was_geschieht_bei_euch_in_der/
1bksei2,“Fatale Fehlentscheidung“: Merz würde Legalisierung von Cannabis bei Wahlsieg rückgängig machen,119,175,t2_aigexaiq,1874033,2024-03-22 06:06:56,https://rp-online.de/politik/deutschland/friedrich-merz-wuerde-cannabis-legalisierung-bei-wahlsieg-kippen_aid-109348551
1bkdlaq,Manipulation der EU-Wahl: Putin rekrutiert Spione und Diplomaten – „Er will Zwietracht säen“,27,3,t2_8mexhw4n,1874033,2024-03-21 18:27:27,https://www.fr.de/politik/russland-manipulation-eu-wahl-putin-rekrutierung-spione-diplomaten-hybrider-krieg-zr-92905358.html
1bkaq17,Bundesregierung will digitale Arbeitsverträge ermöglichen,24,5,t2_w2y7e99,1874033,2024-03-21 16:31:07,https://www.tagesschau.de/inland/arbeitsvertrag-digital-ampel-100.html
1bk4zd2,Stiftung Warentest: Qualität von Olivenöl durch Klimawandel gesunken,18,5,t2_5uod4cet,1874033,2024-03-21 12:06:51,https://www.zeit.de/gesellschaft/2024-03/olivenoel-qualitaet-stiftung-warentest-klimawandel
1bkhqro,EU beschließt Aufnahme von Beitrittsgesprächen mit Bosnien-Herzegowina,20,6,t2_x86wh,1874033,2024-03-21 21:17:21,https://www.zeit.de/politik/ausland/2024-03/eu-beschliesst-aufnahme-von-beitrittsgespraechen-mit-bosnien-herzegowina
1bkedt1,"Archäologie: Spektakulärer Fund zeigt, wie die Menschen die Seefahrt erfanden",19,2,t2_js5a5,1874033,2024-03-21 19:00:12,https://www.sueddeutsche.de/wissen/archaeologie-schifffahrt-italien-einbaum-steinzeit-meer-1.6472939
1bk18bi,"Demoskopie im Test: Wie belastbar sind Online-Umfragen? | Zwei Forscher der Adenauer-Stiftung wollten herausfinden, ob und wie sich Umfragen am Telefon oder online und solche, die Leute auf beiden Wegen erreichen, unterscheiden. Das Ergebnis des Tests ist verblüffend.",18,16,t2_lljpe,1874033,2024-03-21 07:53:52,https://www.faz.net/aktuell/feuilleton/medien/forscher-vergleichen-telefon-und-online-umfragen-19599981.html
1bk13hh,Krieg der Sterne | Sri Lanka streitet über das exakte Datum für ein wichtiges Fest. Das Kultusministerium ließ darüber 42 Astrologen beraten.,14,5,t2_js5a5,1874033,2024-03-21 07:44:06,https://www.sueddeutsche.de/panorama/sri-lanka-neujahrsritual-astrologie-1.6469244
1bka5gq,iPhone: Apple mit umfassender Kartellklage der US-Justiz konfrontiert,7,0,t2_og8rm,1874033,2024-03-21 16:07:26,https://www.spiegel.de/wirtschaft/unternehmen/iphone-apple-mit-umfassender-kartellklage-der-us-justiz-konfrontiert-a-615af14a-8f65-45af-879c-0075d34a5e10
1bk5cte,Augen auf bei der Mietwagenabholung,7,19,t2_1sdx4t9v,1874033,2024-03-21 12:27:46,https://www.reddit.com/r/de/comments/1bk5cte/augen_auf_bei_der_mietwagenabholung/
1bkf85s,"HLI: Der Ort Weiz in der Steiermark mit knapp 12.000 Einwohnern besitzt eine ""City S-Bahn"" mit 5! Bahnhöfen. Bahnfahren innerhalb der Stadt ist seit März kostenlos und die Fahrgastzahlen steigen wohl bald auf 1 Million jährlich.",11,0,t2_9rdi4a91o,1874033,2024-03-21 19:34:12,https://www.reddit.com/r/de/comments/1bkf85s/hli_der_ort_weiz_in_der_steiermark_mit_knapp/
1bkboky,Geldgeschenke für Wahlkreise: CSU und Freie Wähler öffnen die Schatztruhe,5,7,t2_js5a5,1874033,2024-03-21 17:10:06,https://www.sueddeutsche.de/bayern/bayern-geldgeschenke-csu-freie-waehler-fraktionsinitiative-100-millionen-1.6472337
1bkswb5,Es ist Freitag #freitagsfliege 161,18,2,t2_1azol2wv,1874033,2024-03-22 06:41:19,https://i.redd.it/1q7ehke20upc1.png
1bkszal,Bornheim bei Bonn: Hysterische Schreie beim Gamen lösen Polizeieinsatz aus,15,13,t2_51s7wj3g4,1874033,2024-03-22 06:47:09,https://www.spiegel.de/panorama/justiz/bornheim-bei-bonn-hysterische-schreie-beim-gamen-loesen-polizeieinsatz-aus-a-23ea19f3-fb0f-458c-ad20-65195caeadd2
1bkss2q,"#Faktenfuchs: Nein, Leitungswasser macht nicht unfruchtbar",7,21,t2_j5jvan,1874033,2024-03-22 06:33:00,"https://www.br.de/nachrichten/wissen/leitungswasser-macht-nicht-unfruchtbar-faktenfuchs,U7O8bHq"
1bkfbiq,Rundfunkbeitrag möchte rückwirkend Geld,2,1,t2_cgm1scks1,1874033,2024-03-21 19:38:10,https://www.reddit.com/r/de/comments/1bkfbiq/rundfunkbeitrag_möchte_rückwirkend_geld/
1bkevjo,"Ist das ein Scam, den ich nicht verstehe, oder der unglücklichste Kleinanzeigenkäufer der Welt? ",6,28,t2_9mkdu,1874033,2024-03-21 19:19:57,https://www.reddit.com/r/de/comments/1bkevjo/ist_das_ein_scam_den_ich_nicht_verstehe_oder_der/
1bkswak,Reddit: Aktienkurs steigt am ersten Börsentag um 48 Prozent,5,2,t2_lljpe,1874033,2024-03-22 06:41:17,https://www.heise.de/news/Reddit-Aktienkurs-steigt-am-ersten-Boersentag-um-48-Prozent-9662688.html
1bkbmj4,Ich denke ich kann ohne Therapie nicht weiter arbeiten,3,17,t2_n13qiy7n,1874033,2024-03-21 17:07:46,https://www.reddit.com/r/de/comments/1bkbmj4/ich_denke_ich_kann_ohne_therapie_nicht_weiter/
1bk3bvy,Hausnotruf/mobiler Notruf für Senioren - Eigenlösung?,3,10,t2_6zqyqvib,1874033,2024-03-21 10:25:34,https://www.reddit.com/r/de/comments/1bk3bvy/hausnotrufmobiler_notruf_für_senioren_eigenlösung/
1bkrfid,"Kulturfreitag - 22 Mar, 2024",1,10,t2_6l4z3,1874033,2024-03-22 05:01:10,https://www.reddit.com/r/de/comments/1bkrfid/kulturfreitag_22_mar_2024/
1bkmk4p,Gibt es sowas ähnliches wie den Wolf im Schafspelz?,1,1,t2_51cej208,1874033,2024-03-22 00:44:33,https://www.reddit.com/r/de/comments/1bkmk4p/gibt_es_sowas_ähnliches_wie_den_wolf_im_schafspelz/
1bklx52,Bodentruppen in der Ukraine? Frankreich-General nennt Zahlen,10,16,t2_w2y7e99,1874033,2024-03-22 00:14:27,https://www.t-online.de/nachrichten/ukraine/id_100369636/ukraine-frankreichs-generaele-werden-bei-bodentruppen-konkreter.html
1bkh442,Hilfe - Wohnungsamt verweigert Unterstützung und bezieht sich auf eine Klausel die ich nicht finde,2,0,t2_e2kckdnc,1874033,2024-03-21 20:51:52,https://www.reddit.com/r/de/comments/1bkh442/hilfe_wohnungsamt_verweigert_unterstützung_und/
1bksimi,Mehr als 30 Staaten wollen Kernkraft-Ausbau beschleunigen,0,22,t2_rvxk0,1874033,2024-03-22 06:14:53,https://www.tagesschau.de/ausland/europa/atomenergie-allianz-abschlusserklaerung-100.html
1bki2cv,Hinter der Bühne von Rammstein,0,62,t2_js5a5,1874033,2024-03-21 21:30:30,https://www.tagesschau.de/investigativ/ndr/rammstein-lindemann-rekrutierung-fans-100.html
1bk239o,Freiburg: Kommission kritisiert Priesterausbildung,0,1,t2_pk0zvne9,1874033,2024-03-21 08:58:10,https://www.faz.net/aktuell/politik/inland/freiburg-kommission-kritisiert-priesterausbildung-19600280.html
1bk51r6,Rechte Spender für das Berliner Stadtschloss: Kulturrevolution mit Preußen (Gastbeitrag von Philipp Oswalt),0,82,t2_js5a5,1874033,2024-03-21 12:10:40,https://www.zeit.de/kultur/2024-02/berliner-stadtschloss-rechte-spender-rekonstruktion/komplettansicht
1bk5vkl,Psychotherapie für Alle? Hindernisse und Möglichkeiten für Geflüchtete und Migrant:innen in Deutschland,0,8,t2_kfipsmko,1874033,2024-03-21 12:56:06,https://www.reddit.com/r/de/comments/1bk5vkl/psychotherapie_für_alle_hindernisse_und/
1bkfubf,Kugel im Wildfleisch entdeckt - Frau Schwanger - Vergiftung? Was tun?,0,52,t2_8sxfgzyw,1874033,2024-03-21 19:59:47,https://i.redd.it/nqfgunqntqpc1.jpeg
1bk9uk5,"Die Führerscheinprüfung ist so unglaublich, unnötig kompliziert.",0,94,t2_8r2j0see,1874033,2024-03-21 15:54:49,https://www.reddit.com/r/de/comments/1bk9uk5/die_führerscheinprüfung_ist_so_unglaublich/
